{
  "summary": {
    "postedOpportunities": 4,
    "totalSlots": 7,
    "volunteers": 9,
    "readyToAward": 2,
    "watchList": 1
  },
  "filters": {
    "statuses": ["posted", "review", "awarded", "withdrawn"],
    "roles": ["Dispatcher", "Supervisor", "Calltaker"],
    "awardRules": ["Seniority", "Lowest OT Hours", "First Volunteer", "Admin Review"]
  },
  "opportunities": [
    {
      "id": "ot-2026-06-15-disp-d1",
      "date": "2026-06-15",
      "shift": "Days 0700-1900",
      "role": "Dispatcher",
      "spot": "D1",
      "assignment": "Dispatcher D1",
      "reason": "Coverage Shortage",
      "slots": 1,
      "hours": 12,
      "status": "review",
      "priority": "high",
      "awardRule": "Seniority",
      "linkedOpenShiftId": "open-shift-001",
      "coverageImpact": "Under minimum until filled",
      "eligibilityRules": ["Dispatcher qualified", "No approved leave conflict", "Fatigue check clear"],
      "recommendedVolunteerId": "vol-001"
    },
    {
      "id": "ot-2026-06-16-call-c2",
      "date": "2026-06-16",
      "shift": "Evenings 1500-2300",
      "role": "Calltaker",
      "spot": "C2",
      "assignment": "Calltaker C2",
      "reason": "Event Staffing",
      "slots": 2,
      "hours": 8,
      "status": "posted",
      "priority": "normal",
      "awardRule": "Lowest OT Hours",
      "linkedOpenShiftId": "open-shift-002",
      "coverageImpact": "Optional extra staffing",
      "eligibilityRules": ["Calltaking qualified", "Active employee", "Supervisor review"],
      "recommendedVolunteerId": "vol-004"
    },
    {
      "id": "ot-2026-06-17-sup-s1",
      "date": "2026-06-17",
      "shift": "Nights 1900-0700",
      "role": "Supervisor",
      "spot": "S1",
      "assignment": "Supervisor S1",
      "reason": "Sick Coverage",
      "slots": 1,
      "hours": 12,
      "status": "review",
      "priority": "critical",
      "awardRule": "Admin Review",
      "linkedOpenShiftId": "open-shift-003",
      "coverageImpact": "Supervisor minimum not met",
      "eligibilityRules": ["Supervisor eligible", "Mandate eligible fallback", "No overlap"],
      "recommendedVolunteerId": "vol-007"
    },
    {
      "id": "ot-2026-06-19-disp-d3",
      "date": "2026-06-19",
      "shift": "Days 0700-1900",
      "role": "Dispatcher",
      "spot": "D3",
      "assignment": "Dispatcher D3",
      "reason": "Training Backfill",
      "slots": 3,
      "hours": 12,
      "status": "posted",
      "priority": "normal",
      "awardRule": "First Volunteer",
      "linkedOpenShiftId": "open-shift-004",
      "coverageImpact": "Training backfill placeholder",
      "eligibilityRules": ["Radio qualified", "No fatigue warning"],
      "recommendedVolunteerId": "vol-008"
    }
  ],
  "volunteers": [
    {"id":"vol-001","opportunityId":"ot-2026-06-15-disp-d1","employee":"Morgan Price","employeeId":"emp-dispatch-001","submittedAt":"2026-06-13T09:10:00-05:00","status":"eligible","seniorityRank":2,"otHoursYtd":18,"fatigueStatus":"clear","awardRecommendation":"Recommended"},
    {"id":"vol-002","opportunityId":"ot-2026-06-15-disp-d1","employee":"Jordan Lee","employeeId":"emp-dispatch-004","submittedAt":"2026-06-13T09:18:00-05:00","status":"eligible","seniorityRank":4,"otHoursYtd":10,"fatigueStatus":"clear","awardRecommendation":"Alternate"},
    {"id":"vol-003","opportunityId":"ot-2026-06-15-disp-d1","employee":"Riley Stone","employeeId":"emp-dispatch-006","submittedAt":"2026-06-13T09:32:00-05:00","status":"watch","seniorityRank":1,"otHoursYtd":28,"fatigueStatus":"review overlap","awardRecommendation":"Needs review"},
    {"id":"vol-004","opportunityId":"ot-2026-06-16-call-c2","employee":"Taylor Green","employeeId":"emp-call-002","submittedAt":"2026-06-13T10:04:00-05:00","status":"eligible","seniorityRank":7,"otHoursYtd":4,"fatigueStatus":"clear","awardRecommendation":"Recommended"},
    {"id":"vol-005","opportunityId":"ot-2026-06-16-call-c2","employee":"Avery Cook","employeeId":"emp-call-003","submittedAt":"2026-06-13T10:16:00-05:00","status":"eligible","seniorityRank":5,"otHoursYtd":6,"fatigueStatus":"clear","awardRecommendation":"Recommended"},
    {"id":"vol-006","opportunityId":"ot-2026-06-16-call-c2","employee":"Casey Ford","employeeId":"emp-call-004","submittedAt":"2026-06-13T10:29:00-05:00","status":"withdrawn","seniorityRank":3,"otHoursYtd":12,"fatigueStatus":"clear","awardRecommendation":"Withdrawn"},
    {"id":"vol-007","opportunityId":"ot-2026-06-17-sup-s1","employee":"Alex Rivera","employeeId":"emp-sup-001","submittedAt":"2026-06-13T11:02:00-05:00","status":"eligible","seniorityRank":1,"otHoursYtd":22,"fatigueStatus":"clear","awardRecommendation":"Recommended"},
    {"id":"vol-008","opportunityId":"ot-2026-06-19-disp-d3","employee":"Sam Brooks","employeeId":"emp-dispatch-002","submittedAt":"2026-06-13T12:22:00-05:00","status":"eligible","seniorityRank":6,"otHoursYtd":8,"fatigueStatus":"clear","awardRecommendation":"Recommended"},
    {"id":"vol-009","opportunityId":"ot-2026-06-19-disp-d3","employee":"Jamie Patel","employeeId":"emp-dispatch-003","submittedAt":"2026-06-13T12:38:00-05:00","status":"eligible","seniorityRank":8,"otHoursYtd":14,"fatigueStatus":"clear","awardRecommendation":"Alternate"}
  ],
  "awardQueue": [
    {"opportunityId":"ot-2026-06-15-disp-d1","nextAction":"Supervisor award review","recommended":"Morgan Price","status":"ready"},
    {"opportunityId":"ot-2026-06-17-sup-s1","nextAction":"Admin approval required","recommended":"Alex Rivera","status":"ready"},
    {"opportunityId":"ot-2026-06-16-call-c2","nextAction":"Wait for posting close","recommended":"Taylor Green / Avery Cook","status":"pending"}
  ],
  "rules": [
    "Employees may volunteer or withdraw while the opportunity remains posted.",
    "Award preview uses configured rule, but production awards remain disabled.",
    "Eligibility checks consider role qualification, leave conflicts, fatigue warnings, and supervisor override flags.",
    "Awarded OT will later create assignment engine records and notification queue entries."
  ]
}
